,_cached_page_id,_template,_type,description,details,floor,location,pow,price,rooms,url
7470,45a63b148fb5598418512b940f964739ef476678,253c6e77b6b11e1a3e06b6eede2878676c9abf47,default,"Opis Bardzo ładne przestronne mieszkanie położone w willowej części osiedla Arkońskiego. Mieszkanie mieści się na pierwszym piętrze w 4- rodzinnej willi. Lokal o powierzchni całkowitej 96 m2 składające się z 4 rozkładowych pokoi, kuchni, łazienki oraz korytarza. Pokoje duże ustawne, kuchnia w gustownej zabudowie. Łazienka z kabiną prysznicową w glazurze i terakocie. Ściany gładzone i malowane, na podłogach położone są panele. Do mieszkania przynależy garaż murowany, ogródek ( 246 m2), duża piwnica ( 20m2), oraz strych nad mieszkaniem ( istnieje możliwość adaptacji). Mieszkanie jest bezczynszowe, ogrzewanie i ciepła woda z pieca gazowego dwu-obiegowego. Polecam ze względu na znakomitą lokalizację oraz bardzo atrakcyjną cenę jak na tego typu nieruchomość. Zapraszam na prezentację. Oferta wysłana z programu dla biur nieruchomości - asariWEB Kontakt Dorota Żabczyńska Telefon :",rynek: wtórny rodzaj zabudowy: blok materiał budynku: cegła okna: plastikowe ogrzewanie: gazowe rok budowy: 1950 stan wykończenia: do zamieszkania forma własności: pełna własność media telewizja kablowa internet,1.0,"Mieszkanie na sprzedaż , Szczecin , OS. ARKOŃSKIE, Arkońska - Zobacz na mapie",96.0,470,4.0,http://otodom.pl/oferta/mieszkanie-96-m-szczecin-ID1wA8c.html
273,c42a07a41ac037f500c66ed3b2fd4478552966bb,253c6e77b6b11e1a3e06b6eede2878676c9abf47,default,"Opis Okazja 0%oferta bezpośrednia, klient kupujący nie płaci prowizji pośrednikowi, wynagrodzenie pośrednika pokrywa sprzedający.Absolutnie gotowe do zamieszkania, przepiękne mieszkanie 3 pokojowe, po kapitalnym remoncie, na 3 piętrze w wyremontowanym budynku(nowe elewacje,dach,wszystkie piony), zlokalizowane we wspaniałej ,lokalizacji prawobrzeża, w niskim budynku,przy jeziorku słonecznym ul.Jasna.Wspaniała lokalizacja z widokiem na puszczę bukową, słońce wdziera się do okien (prezentacja okien wschód,południe-zachód) , pełna prywatność,nikt nie zagląda w okna. Mieszkanie gotowe do zamieszkania, ślicznie zaaranżowane i przytulnie wykończone (nowe instalacje i piony,klatka schodowa).Składa się z 3 pokoi powierzchnie około 18/11/9 mkw , kuchni oraz łazienki i wc.Salon o powierzchni około 18 mkw, wykończony gładziami i pomalowany w nowoczesnych pistacjowych kolorach, dodatkowo zainstalowano o świetlenie punktowe w wymyślnie zaprojektowanych wnękach.Ściany wygładzono,a na bokach wykonano nowoczesne zabudowy pionów grzewczych, dzięki temu mieszkanie zyskało bardzo nowoczesny styl. Salon łączy się z dużym przestronnym balkonem o powierzchni około 4 mkw, który wychodzi na spokojną zazielenioną stronę.Kuchnia bardzo ładnie zaaranżowana, zabudowana meblami pod wymiar, wysokiej jakości terakotą i armaturą, oraz sprzętem agd.Sciany w kuchni wykończono śliczną glazurą i terakotą oraz dekorami. Dodatkowo wykonano półwysep jadalny.Na przedpokoju zamontowano nowoczesną garderobę typu komandor, ściany wykończono dodatkowymi ozdobnymi panelami oświetlonniem sufitowym. W cenie mieszkania pozostają wszystkie stałe zabudowy ( garderoba, zabudowy typu komandor,przedpokój i sypialnia) i część mebli (do uzgodnienia).W kuchni bardzo przemyślnie zagospodarowano miejsce na jadalnię , dzięki temu kuchnia posiada wspaniały klimat i funkcjonalność.W mieszkaniu znajdują się również dwie wygodne klimatyczne sypialnie o pow. około 11 i 9 mkw, na podłogach położono nowoczesną terakotę, ściany wygładzono i pomalowano.Na podłogach w przedpokoju, kuchni i łazience w nowoczesnym stylu położono glazurę o pięknych wzorach. Wszystkie okna są nowe pcv plus rolety wewnętrzne. Dodatkowym plusem mieszkania jest funkcjonalna łazienka, o pow. około 3,5 mkw.Wykończona jest jasną ciekawą glazurą , terakotą,podwieszanym sufitem z ciekawym punktowym oświetleniem w kształcie piramidek. W wyposażeniu znajduje się kabina prysznicowa z brodzikiem, umywalka, wc, grzejnik drabinkowy, lustro, szafki łazienkowe,pralka i toaletka.Oddzielne wc o pow. około 1,5 mkw również wykończono glazurą i terakotą.Ogólnie mieszkanie niesamowicie czyste zadbane i pachnące, posiadające bardzo przyjemny klimat , po prostu ma to coś, jest słoneczne ciepłe i przytulne.Niełatwo jest to opisać, zalecam osobistą weryfikację.Do mieszkania przynależy wygodna piwnica.Wspaniała lokalizacja, w pobliżu markety, wiele sklepów i centrów handlowych,przedszkole, komunikacja miejska, gabinety lekarskie, szkoły i przedszkola,tereny rekreacyjne, restauracje i wiele innych udogodnień.Okazja polecam serdecznie i zapraszam na prezentacje. Oferta wysłana z programu dla biur nieruchomości - asariWEB Kontakt Łukasz Lewiński Telefon :",rynek: wtórny rodzaj zabudowy: blok materiał budynku: wielka płyta okna: plastikowe ogrzewanie: miejskie rok budowy: 90 stan wykończenia: do zamieszkania czynsz: 400 zł forma własności: pełna własność media telewizja kablowa internet,3.0,"Mieszkanie na sprzedaż , Szczecin , Słoneczne , Jasna - Zobacz na mapie",57.5,269,3.0,http://otodom.pl/oferta/0-oferta-bezposrednia-piekne-3-pokoje-os-sloneczne-ID2W9Ht.html
1727,68a14f5f6d4abab5696b706af6b1bb9fc46bbe28,253c6e77b6b11e1a3e06b6eede2878676c9abf47,default,"Opis 2-poziomowe mieszkanie (powierzchnia użytkowa 75,19; powierzchnia liczona po podłodze - około 100 m2), usytuowane na 2 piętrze w budynku (z 2000 roku) znajdującym się na cichym zielonym osiedlu. Pierwotnie mieszkanie było 4 pokojowe (bez większego problemu można przywrócić pierwotny układ) Na powierzchnię mieszkania składa się: POZIOM I: - przedpokój (na podłodze terakota; wbudowana szafa typu komandor), toaleta z umywalką, łazienka (wanna, wc, umywalka), sypialnia (na podłodze panele, szafa typu komandor), kuchnia (meble w zabudowie wraz ze sprzętem AGD), pokój dzienny (wydzielone dwie strefy: jadalnia i część wypoczynkowa) z którego schodami wchodzimy na POZIOM II: otwarta przestrzeń z wydzieloną łazienką (kabina prysznicowa, wc, umywalka). W pokojach na podłodze panele, okna PCV i połaciowe. Ogrzewanie i podgrzanie wody - kotłownia osiedlowa Niskie koszty utrzymania. Czynsz należny zarządcy - 450 zł (z FR, zaliczkami na wodę i ogrzewanie). Ciche zielone miejsce, sprzyjające wypoczynkowi, a jednocześnie blisko środki komunikacji miejskiej, sklepy (zarówno małe osiedlowe jak i większe np Piotr i Paweł). Przed wejściem do budynku znajduje się miejsce parkingowe przypisane do wyłącznego korzystania właścicielom mieszkania - dodatkowa opłata za zakup miejsca parkingowego - 5.000 zł. Pośrednik odpowiedzialny zawodowo za wykonanie umowy pośrednictwa: Grażyna Zdawska (licencja nr: 5915) Oferta wysłana z systemu Galactica Virgo Kontakt Grażyna Zdawska Telefon :",rynek: wtórny rok budowy: 2000 forma własności: pełna własność,2.0,"Mieszkanie na sprzedaż , Szczecin , Pogodno - Zobacz na mapie",75.18,315,3.0,http://otodom.pl/oferta/mieszkanie-75-18-m-szczecin-ID2Uf8D.html
6194,975325122bda82be3b3dd7846e230572c2a70752,253c6e77b6b11e1a3e06b6eede2878676c9abf47,default,"Opis Piękne, klimatyczne, słoneczne i bardzo ciepłe mieszkanie położone w samym sercu miasta w pobliżu Placu Lotników. Pokoje o powierzchni 22, 29, 30 i 34 m2. Na podłogach oryginalna, znakomicie zachowana deska, w kuchni, łazience i przedpokoju terakota. Ściany gładzone, malowane na ciepłe kolory. Kuchnia w zabudowie, ze sprzętem w cenie nieruchomości. Pokoje znajdują się od strony południowej, kuchnia od północnej, sypialnia od wschodniej. Klatka schodowa i elewacja w trakcie remontu. W 2011 roku wykonano termoizolacje pionową i poziomą oraz przeprowadzono remont dachu. Z jednego z pokoi wyjście na balkon o powierzchni 4 m2. Do mieszkania przynależy 34 m piwnica z bezpośrednim wejściem z ulicy. Między dwoma pokojami pierwotnie amfilada, istnieje możliwość połączenia pokoi i stworzenia ponad 60 metrowego salonu. W najbliższej okolicy przedszkola, szkoły, sklepy, apteki, przystanki. W mieszkaniu rozprowadzona instalacja alarmowa, telewizyjna, telefoniczna i internetowa do każdego pomieszczenia. Serdecznie zapraszam na prezentację! ::DODATKOWE INFORMACJE Rodzaj budynku: kamienica Parking strzeżony (odległość w metrach) [m]: 200,00 Dozór budynku: nie Głośność: ciche Widok: na podwórko Gaz: tak - miejski Woda: tak - ciepła junkers Dojazd: droga asfaltowa Otoczenie: działki zabudowane Ogrzewanie: własne gazowe Linie telefoniczne: TAK Alarm: TAK Internet: TAK Telewizja kablowa: TAK Komunikacja publ.: autobus miejski, tramwaj Winda: NIE Rozkład: trzystronne rozkładowe Usytuowanie: trójstronne Drzwi antywłamaniowe: TAK Opłaty w czynszu: woda Opłaty wg liczników: prąd, gaz Rodzaj mieszkania: jednopoziomowe Piwnica [m2]: 34,00 Piwnica: TAK Stan lokalu: Do odświeżenia Okna: nowe PCV Instalacje: częściowo wymienione Balkon: mały Ilość balkonów: 1 Powierzchnia balkonów/tarasów [m2]: 4,00 Powierzchnia użytkowa [m2]: 148,10 Rok budowy: 1930 Ilość pokoi: 4 Wysokość pomieszczeń [m]: 3,80 Ilość sypialni: 3 Powierzchnia pokoi [m2]: 22/29/30/34 Podłogi pokoi: deski Ściany pokoi: gładzie gipsowe Wystawa okien - pokoje : Wsch, Pd Typ kuchni: oddzielna Rodzaj kuchni: z zabudową kuchenną Powierzchnia kuchni [m2]: 18 Podłoga kuchni: terakota Wystawa okien - kuchnia: Pn Typ łazienki: osobno z wc, z oknem Ilość łazienek: 1 Powierzchnia łazienki [m2]: 8 Glazura łazienki: nowego typu Podłoga łazienki: terakota Wyposażenie łazienki: natrysk Ściany łazienki: glazura Wystawa okien - łazienka : Wsch Ilość WC: 1 Powierzchnia WC: 2 Glazura WC: starszego typu Podłoga WC: terakota Ściany WC: glazura Ilość przedpokoi: 2 Powierzchnia przedpokoi [m2]: 6 Podłoga przedpokoi: panele, terakota Ściany przedpokoi: boazeria ::KONTAKT DO AGENTA Adam Myśków ( pokaż numer ) ( pokaż numer ) ::DANE BIURA Lex House- Centrala Agencja Obrotu Nieruchomościami Śląska 40 70-432 Szczecin ( pokaż numer ) Pośrednik odpowiedzialny zawodowo za wykonanie umowy pośrednictwa: Bogumiła Ambroziak (licencja nr: 9850) Oferta wysłana z systemu Galactica Virgo Kontakt Adam Myśków Telefon :",,3.0,"Mieszkanie na sprzedaż , Szczecin , Centrum - Zobacz na mapie",148.1,650,4.0,http://otodom.pl/oferta/mieszkanie-148-10-m-szczecin-ID2jh7p.html
4125,49f2b78c9c8e39f466efb5c9f3cf8c5fe5251313,253c6e77b6b11e1a3e06b6eede2878676c9abf47,default,"Opis NOWA INWESTYCJA DEWELOPERSKA Na Sprzedaż mieszkania 1,2 pokojowe typu STUDIO w stanie deweloperskim w śródmieściu - centrum Szczecina. W bardzo dogodnej lokalizacji, blisko Wałów Chrobrego, sklepów przystanków, szkół. Atrakcyjna lokalizacja nie wysoka cena !!! W ofercie mieszkania 1,2 pokojowe od 29 - 49 m2, o różnym układzie dostępne na I, II, III, IV, V pietrze. Ceny są orientacyjne i mogą ulec zmianie !!!! Termin realizacji grudzień 2016 Zapraszam do prezentacji. Kontakt Krzysztof Wala Telefon :",,1.0,"Mieszkanie na sprzedaż , Szczecin , Centrum - Zobacz na mapie",39.9,192,2.0,http://otodom.pl/oferta/mieszkanie-39-90-m-szczecin-ID2NtSJ.html
3498,1e4920ebecd6726011183a802a00330d5c275569,253c6e77b6b11e1a3e06b6eede2878676c9abf47,default,"Opis Mieszkanie do własnej aranżacji gdzie w pokojach na podłodze wykładzina dywanowa, ściany pomalowane.W łazience na podłodze płytki pcv, ściany wytapetowane. W kuchni na podłodze linoleum, ściany wytapetowane.Atutem mieszkania jest duży balkon. Mieszkanie położone w cichej i spokojnej części dzielnicy w pobliżu przystanki komunikacji miejskiej. Mieszkanie przeznaczone dla osób ,które chcą urządzić mieszkanie według własnych upodobań. Zobacz podobne oferty na Zobacz jak możesz sprzedać swoją nieruchomość Oferta wysłana z programu dla biur nieruchomości - asariWEB Kontakt Władysław Peisert Telefon :",rynek: wtórny rodzaj zabudowy: blok materiał budynku: cegła okna: plastikowe ogrzewanie: miejskie rok budowy: 1945 stan wykończenia: do remontu czynsz: 360 zł forma własności: pełna własność,,"Mieszkanie na sprzedaż , Szczecin , Niebuszewo , Heleny - Zobacz na mapie",47.0,170,2.0,http://otodom.pl/oferta/2-pokoje-do-47-m2-do-wlasnej-aranzacji-ID2Qepn.html
584,3be77ee07ccddcbcce5bdf1ae44453972767f135,253c6e77b6b11e1a3e06b6eede2878676c9abf47,default,"Opis Przestronne mieszkanie w Centrum Szczecina. Składa się z 3 rozkładowych pokoi (20 m2 + 19 m2 + 17 m2) , widnej kuchni (11 m2), łazienki z toaletą (7 m2) , osobnego pomieszczenia gospodarczego (6 m2) i przedpokoju (6 m2). Ściany gładzone, na podłogach panele i deski podłogowe cyklinowane i lakierowane. Kuchnia, łazienka, korytarz - na podłogach kafle. Nowa instalacja elektryczna i wodna. Wygodny balkon (5 m2). Przynależna piwnica. Okna wszystkich pokoi znajdują się od strony ulicy, a kuchni, łazienki i pomieszczenia gospodarczego od strony wewnętrznego podwórka. Okna drewniane (malowane na biało) nowego typu. Własne ogrzewanie gazowe (piec gazowy jest w kuchni). Mieszkanie do odświeżenia. Czynsz ok 450 zł ( z funduszem remontowym, wodą, wywozem śmieci, itd). Kamienica posiada wyremontowany dach, ładny i zadbany przedogródek, klatka schodowa i wejście do kamienicy jest monitorowane, mieszkanie wyposażone w wideofon. W tym roku będzie robiony remont elewacji łącznie z ociepleniem całego budynku. Klatka schodowa czysta i schludna. Spokojni i przyjaźni lokatorzy. Własność z KW. Zapraszam do prezentacji, Krzysztof Burzyński PÓŁNOC Nieruchomości O/Szczecin tel: ( pokaż numer ) e-mail: Nr licencji zawodowej pośrednika: 8183 Więcej ofert znajdziesz na naszej stronie * UWAGA! Zamieszczone na naszych stronach oferty nie stanowią oferty w rozumieniu Kodeksu Cywilnego, a dane w nich zawarte mają jedynie charakter informacyjny. Oferta wysłana z programu dla biur nieruchomości - asariWEB Kontakt Krzysztof Burzyński Telefon :",rynek: wtórny rodzaj zabudowy: kamienica materiał budynku: cegła okna: drewniane ogrzewanie: gazowe rok budowy: 1910 stan wykończenia: do zamieszkania czynsz: 450 zł forma własności: pełna własność,3.0,"Mieszkanie na sprzedaż , Szczecin , Bolesława Śmiałego - Zobacz na mapie",86.0,330,3.0,http://otodom.pl/oferta/szczecin-centrum-86-m2-w-kamienicy-ID2V0OZ.html
783,401858f92bbc1bd2f3817c1a1706909a16da9bf3,253c6e77b6b11e1a3e06b6eede2878676c9abf47,default,"Opis Zadbane z ładnym widokiem. Pokoje rozkładowe, większy ok 16 m2 z balkonem, mniejszy ok. 10 m2. W pokojach i przedpokoju parkiet. Kuchnia z oknem. Łazienka z toaletą oddzielnie. Okna pcv. W przedpokoju i sypialni szafy z drzwiami przesuwnymi. C.o. i ciepła woda z sieci miejskiej. Niskie koszty utrzymania. Blisko centrum i dobre połączenia komunikacji miejskiej. Blok ocieplony. Małgorzata ( pokaż numer ) Powyższe informacje zostały sporządzone na podstawie oświadczeń i nie są ofertą w rozumieniu przepisów prawa. Mają charakter informacyjny. Kontakt Małgorzata Klimczewska Telefon :",rynek: wtórny rodzaj zabudowy: blok materiał budynku: wielka płyta okna: plastikowe ogrzewanie: miejskie czynsz: 380 zł forma własności: pełna własność dostępne od: 2 Maja 2016 media telewizja kablowa internet,7.0,"Mieszkanie na sprzedaż , Szczecin , Świerczewo , Hieronima Derdowskiego - Zobacz na mapie",44.0,180,2.0,http://otodom.pl/oferta/przyjazni-tanie-2-pokojowe-zarezerwowane-ID2WK2r.html
2152,59263b95c96b5973a150167e06ac7da40b6a9d6d,253c6e77b6b11e1a3e06b6eede2878676c9abf47,default,"Opis Jeśli szukasz mieszkania w samym centrum Szczecina (al. Piastów) , w zadbanej kamienicy z czystą klatką schodową ta oferta skierowana jest właśnie do Ciebie. Adaptacja wykończona ""pod klucz"" ,ściany wygładzone i pomalowane na biało ,w pokoju i przedpokoju panele dobrej jakości, łazienka z kabiną i umywalką w nowoczesnej glazurze i terakocie. Okna nowe PCV . Drzwi zewnętrzne antywłamaniowe. Nowe instalacje elektryczna,wodno-kanalizacyjna, gazowa. Ogrzewanie i ciepła woda z nowego 2 obiegowego z zamkniętą komorą spalania .Dach ocieplony wełną mineralną o gr. 25cm, izolacja folią przepuszczalną, 4 płyty gkl. Powierzchnia użytkowa mieszkania to 27,93m2, całkowita 29,93m2. Niskie koszty utrzymania lokalu. Czynsz administracyjny wynosi ok.100 zł. z funduszem remontowym. Nieruchomość położona w ścisłym centrum miasta - bliskość do komunikacji, szkół, sklepów itp. Kupujący zwolniony z opłaty PCC 2% do urzędu skarbowego. Polecamy i zapraszamy na prezentację posiadamy tylko trzy mieszkania o pow. użyt. 33,83 (2pokoje), 27,93m2, 23,31m2. Przewidywany termin oddania to kwiecień 2016r. -Pomożemy Państwu uzyskać kredyt na zakup nieruchomości. Posiadamy ofertę z 23 banków. -LICENCJONOWANE BIURO - BEZPIECZNY ZAKUP! na naszej stronie znajdą Państwo około 17.000 aktualnych ofert nieruchomości -Pośrednik odpowiedzialny zawodowo za wykonanie umów pośrednictwa, posiadający ubezpieczenie OC WARTA S.A.: Piotr Bury (licencja nr.18874) mob: ( pokaż numer ) . Małgorzata Góra, Rzeczoznawca Majątkowy (numer uprawnień 6257) mob: biuro: ( pokaż numer ) -Niniejsza oferta nie jest ofertą handlową w rozumieniu art. 66 §1 kodeksu cywilnego. Oferta wysłana z programu dla biur nieruchomości - asariWEB Kontakt Biuro Nieruchomości 360INVESTMENT Telefon :",rynek: wtórny rodzaj zabudowy: kamienica materiał budynku: cegła okna: plastikowe ogrzewanie: gazowe rok budowy: 1930 stan wykończenia: do zamieszkania forma własności: pełna własność,4.0,"Mieszkanie na sprzedaż , Szczecin , Centrum - Zobacz na mapie",29.93,134,1.0,http://otodom.pl/oferta/centrum-nowa-adaptacja-zadbana-kamienica-ID2TjiH.html
6978,4b6752df1a531c5bf8b322fe94101cfb9080afe2,253c6e77b6b11e1a3e06b6eede2878676c9abf47,default,"Opis Mieszkanie czteropokojowe, w pełni rozkładowe. Kuchnia w zabudowie, widna. Łazienka z wanną, wc osobno. Od strony południowej z największego pokoju wyjście na duży balkon. Mieszkanie jest po remoncie, okna PCV pięciokomorowe, panele czwarty stopień ścieralności, na ścianach gładź i zmywalna farba. Na balkonie terakota. Blok był dwa lata temu ocieplony, w bloku jest miejsce na rowery (wózkownia). Wewnętrzne podwórko duże, zazielenione z miejscami zabaw dla dzieci. Zapraszamy na prezentację. Oferta wysłana z programu dla biur nieruchomości - asariWEB Kontakt Telefon :",rynek: wtórny rodzaj zabudowy: blok okna: plastikowe ogrzewanie: miejskie rok budowy: 1985 stan wykończenia: do zamieszkania,4.0,"Mieszkanie na sprzedaż , Szczecin , Pomorzany , Zenona Klemensiewicza - Zobacz na mapie",64.0,245,4.0,http://otodom.pl/oferta/mieszkanie-64-m-szczecin-ID1Xx6J.html
7509,23d4c6279bb812cbe1562e558de900e4f0950462,253c6e77b6b11e1a3e06b6eede2878676c9abf47,default,"Opis Mieszkanie położone w centrum w okolicy Jasnych Błoni. Kamienica zadbana i czysta. Wymienione piony wodno-kanalizacyjne i dach, wyremontowana klatka schodowa. Wymienione okna i instalacja elektryczna. W okolicy dużo zieleni. Mieszkanie rozkładowe z przestronnym przedpokojem i trzema dużymi i słonecznymi pokojami ( 24, 22 i 12 m2). Na podłogach oryginalny parkiet, wymagający tylko okresowych prac konserwacyjnych. Ściany gładkie, malowane. Salon z dużym balkonem od strony ulicy z działającą markizą. W sypialni duża garderoba przystosowana do indywidualnej aranżacji. Kuchnia z balkonem od strony podwórza. Łazienka razem z toaletą - widna o powierzchni ok. 6 m2. Do zamieszkania praktycznie od zaraz. Zapraszam na prezentację "" na żywo"". Zobacz podobne oferty na Zobacz jak możesz sprzedać swoją nieruchomość Oferta wysłana z programu dla biur nieruchomości - asariWEB Kontakt Bartosz Ciżmowski Telefon :",rynek: wtórny rodzaj zabudowy: kamienica materiał budynku: cegła okna: plastikowe ogrzewanie: miejskie rok budowy: 1938 stan wykończenia: do zamieszkania czynsz: 860 zł forma własności: pełna własność,3.0,"Mieszkanie na sprzedaż , Szczecin , Centrum , Mieczysława Niedziałkowskiego - Zobacz na mapie",86.27,394,3.0,http://otodom.pl/oferta/mieszkanie-86-27-m-szczecin-ID1t7bE.html
6286,bc37fff0a564bc635e8b6a6edfc0f7289ef0d054,253c6e77b6b11e1a3e06b6eede2878676c9abf47,default,"Opis Mieszkanie w 4 piętrowym apartamentowcu w bardzo spokojniej, zielonej i cichej okolicy. Ogrzewanie i cw. z sieci miejskiej. Wysoka jakość wykonania budynku,budynek z windą. Bardzo dobrze skomunikowane z całym miastem, szybki dojazd do centrum. Zapraszam na prezentację. Cena do negocjacji! Kontakt Krzysztof Wala Telefon :",rynek: pierwotny rodzaj zabudowy: apartamentowiec materiał budynku: cegła okna: plastikowe ogrzewanie: miejskie rok budowy: 2015 stan wykończenia: do wykończenia forma własności: pełna własność,2.0,"Mieszkanie na sprzedaż , Szczecin , Gumieńce - Zobacz na mapie",53.13,244,2.0,http://otodom.pl/oferta/mieszkanie-53-13-m-szczecin-ID2ivkt.html
6929,993ea89ff0aa956f212ca948105f258d763656ec,253c6e77b6b11e1a3e06b6eede2878676c9abf47,default,"Opis Na sprzedaż mieszkanie na Gumieńcach, stan developerski w bliźniaku dwu kondygnacyjnym. Powierzchnia całkowita 80m2, wspólna klatka schodowa. W mieszkaniu są trzy pokoje: salon z kuchnią 32,70m2 z którego jest wyjście na taras i ogród i dwie sypialnie 16,70m2/16,60m2, łazienka 7,70m2. W mieszkaniu jest ogrzewanie gazowe (piec dwuobiegowy). Rozprowadzona instalacja elektryczna Rozprowadzona instalacja wodno-kanalizacyjna Okna PCV - białe Ściany zewnętrzne silka ocieplane styropianem Podjazd , dojście do domu kostka brukowa - miejsce parkingowe Wyrównany obsadzony trawą teren Zapraszam do prezentacji. ::LINK DO STRONY ?id=88251 ::DANE BIURA KING NIERUCHOMOŚCI AGENCJA OBROTU NIERUCHOMOŚCIAMI MICHAŁ KRAWCZYK Jagiellońska 18/1 70-362 Szczecin ( pokaż numer ) Pośrednik odpowiedzialny zawodowo za wykonanie umowy pośrednictwa: Małgorzata Maciejewska (licencja nr: 16168) - ***** SKUPUJEMY MIESZKANIA ZADŁUŻONE ZA GOTÓWKĘ ***** -------------ZADZWOŃ ( pokaż numer ) ------------------ *Powyższa oferta ma charakter jedynie informacyjny i została utworzona na podstawie oświadczeń właściciela nieruchomości, niniejsza oferta nie stanowi oferty handlowej w rozumieniu art. 66 §1 kodeksu cywilnego oraz innych właściwych przepisów prawnych. Oferta wysłana z systemu Galactica Virgo Kontakt Małgorzata Maciejewska Telefon :",rynek: pierwotny rodzaj zabudowy: blok materiał budynku: pustak okna: plastikowe ogrzewanie: inne rok budowy: 2013 stan wykończenia: do wykończenia forma własności: pełna własność,,"Mieszkanie na sprzedaż , Szczecin , Gumieńce - Zobacz na mapie",80.0,435,3.0,http://otodom.pl/oferta/mieszkanie-80-m-szczecin-ID20dpp.html
2883,c95680c893d3da02b8cbf624732abdbabe502a81,253c6e77b6b11e1a3e06b6eede2878676c9abf47,default,"Opis Do sprzedaży 2 pokojowe mieszkanie o powierzchni 47,40 m2 w wieżowcu na 8 piętrze. Lokal ciepły, nie wymaga intensywnego ogrzewania. W skład mieszkania wchodzi salon o powierzchni 25 m2 oraz mniejszy pokój o powierzchni 10 m2. Widna kuchnia z zabudową kuchenną. Do mieszkania przynależy piwnica o powierzchni 3 m2. Oferta godna zainteresowania z uwagi na doskonałą lokalizację i bliskość komunikacji i szkoły. Cena do negocjacji. Oferta wysłana z programu dla biur nieruchomości - asariWEB Kontakt Monika Młodawska Telefon :",rynek: wtórny rodzaj zabudowy: blok materiał budynku: wielka płyta ogrzewanie: miejskie rok budowy: 1980 stan wykończenia: do remontu czynsz: 300 zł forma własności: spółdzielcze własnościowe media telewizja kablowa,8.0,"Mieszkanie na sprzedaż , Szczecin , Kaliny , Stanisława Ignacego Witkiewicza - Zobacz na mapie",47.4,193,2.0,http://otodom.pl/oferta/mieszkanie-47-40-m-szczecin-ID2Rsvd.html
6636,0d3227cf1696ac69ac088b53288cfdb23b1989c8,253c6e77b6b11e1a3e06b6eede2878676c9abf47,default,"Opis Ładne, słoneczne, rozkładowe mieszkanie położone od południowej strony ul. Dubois, bardzo ciepłe i ciche. W pokojach na podłogach deska. Łazienka w glazurze i terakocie, z kabiną prysznicową, umywalką, razem z wc. Duża kuchnia z miejscem jadalnianym. Umeblowanie i sprzęt agd w cenie. Kapitalny remont został przeprowadzony w 2000 r. Wymienione zostały instalacje: elektryczna, gazowa, CO wraz z kaloryferami, wodna i kanalizacyjna. Ogrzewanie gazowe. Wszystkie okna nowe PCV. Drzwi antywłamaniowe. Do mieszkania przynależy piwnica 10,86m2. Blisko sklepy, gimnazjum oraz Park Żeromskiego. Polecamy. * Oferta Agencji POSESJA Nieruchomości. Przygotowujemy aktualne oferty wg wytycznych klienta! Napisz jakiej nieruchomości szukasz, a wyselekcjonujemy z ogromnej bazy / 20.000 ofert / tylko te właściwe lub szukaj na . Ponadto zapewniamy natychmiastową informację o każdej nowej ofercie! Pomożemy nieodpłatnie uzyskać kredyt bankowy / oferta 20 banków /. 23-letnie doświadczenie połączone z nowoczesną obsługą gwarancją naszej skuteczności. Zapraszamy do Agencji Posesja: al. Papieża Jana Pawła II 18 Szczecin tel. ( pokaż numer ) ; Oferta wysłana z programu dla biur nieruchomości - asariWEB Kontakt agent POS Telefon :",rynek: wtórny rodzaj zabudowy: kamienica materiał budynku: cegła ogrzewanie: gazowe rok budowy: 1901 stan wykończenia: do zamieszkania czynsz: 357 zł forma własności: pełna własność media telewizja kablowa internet telefon,2.0,"Mieszkanie na sprzedaż , Szczecin , Grabowo , Stanisława Dubois - Zobacz na mapie",45.82,190,2.0,http://otodom.pl/oferta/dwupokojowe-rozkladowe-mieszkanie-po-remoncie-ID29ujh.html
