,_cached_page_id,_template,_type,description,details,floor,location,pow,price,rooms,url
3863,450f13873a61e00d2ac3f44b2d9b904f63cc0a9d,253c6e77b6b11e1a3e06b6eede2878676c9abf47,default,"Opis Okazja! Przedmiotem oferty jest nowe mieszkanie połozone w dzielnicy Bukowo. Mieszkanie usytuowane na parterze w nowopowstającym budynku mieszkalnym dwunastorodzinnym. Przy zakupie mieszkania można skorzystać z programu MDM i uzyskać dopłatę do kilkunastu tysięcy zł! W skład mieszkania wchodzą: salon z aneksem kuchennym, sypialnia,ł azienka, balkon. Mieszkanie ładne, przejrzyste, rozkładowe, dużo słońca. Istnieje możliwość zakupu mnieszkania również na , I piętrze Do mieszkań na parterze można dokupic sobie ogródek. W cenie miejsce postojowe przed budynkiem, lub za dopłatą miejsce garażowe pod budynkiem. Ilość mieszkań w promocji ograniczona! Gorąco polecam ze względu na bardzo dobrą cenęi bardzo ładne położenie Kontakt Telefon :",rynek: pierwotny rodzaj zabudowy: blok okna: plastikowe ogrzewanie: gazowe rok budowy: 2015 stan wykończenia: do wykończenia czynsz: 200 zł forma własności: pełna własność dostępne od: 4 Listopada 2015 media telewizja kablowa internet telefon,,"Mieszkanie na sprzedaż , Szczecin , Bukowo - Zobacz na mapie",35.21,133,2.0,http://otodom.pl/oferta/najtansze-mieszkania-w-szczecinie-ID2OQip.html
5790,d8125df2a4c27a85d7005c5dc0a76deb6c92eb46,253c6e77b6b11e1a3e06b6eede2878676c9abf47,default,"Opis Okazja! Duże przestronne rozkładowe 3-pokojowe mieszkanie do remontu o powierzchni 77,84m2 usytuowane na parterze kamienicy. Pokoje rozkładowe ok.25, 18 i 18m2. Dwa pokoje 25 i 18m2 od strony ulicy. Na podłodze stare deski, na nich wykładzina dywanowa. Ściany wytapetowane. Kuchnia z oknem. Na podłodze linoleum, pas glazury na ścianie. Łazienka z oknem w jasnej glazurze i terakocie z wanną, pralką, umywalką i wc. Okna starszego typu. Kamienica przed remontem. Czynsz 310zł. Ogrzewanie gazowe i ciepła woda z pieca II-obiegowego gazowego. Do mieszkania przynależy piwnica. Do wydania od zaraz. Atrakcyjna cena! Zapraszamy. Oferta wysłana z programu dla biur nieruchomości - asariWEB Kontakt Rafał Bobowicz Telefon :",rynek: wtórny rodzaj zabudowy: kamienica materiał budynku: cegła ogrzewanie: gazowe rok budowy: 1935 stan wykończenia: do remontu czynsz: 310 zł forma własności: pełna własność media telewizja kablowa internet,,"Mieszkanie na sprzedaż , Szczecin , Centrum , Księcia Bogusława X - Zobacz na mapie",77.84,209,3.0,http://otodom.pl/oferta/mieszkanie-77-84-m-szczecin-ID2oOnK.html
4582,d28cf90552d0498318ef110c566e2686030c1b9c,253c6e77b6b11e1a3e06b6eede2878676c9abf47,default,"Opis Na sprzedaż wyjątkowe, oryginalne i komfortowe mieszkanie powstałe w wyniku adaptacji poddasza pięknej, zabytkowej i zadbanej kamienicy, położone w cichym Centrum Szczecina. Z balkonu niezwykły widok na dachy sąsiednich budynków oraz wieże katedry i kościołów. Można stąd podziwiać pokazy sztucznych ogni odbywające się kilka razy do roku na Wałach Chrobrego. Na powierzchnię 97,26m2 składają się: otwarta przestrzeń ok. 54m2 obejmująca salon (32m2), przedpokój (12m2) i kuchnię (10m2) - brak ścianek działowych i tyko jedna kolumna podkreślająca styl mieszkania, zachodnia strona świata; 3 niezależne sypialnie od wschodu (po ok. 12m2), największa z własną łazienką i tarasikiem, dalej druga łazienka i osobne wc. W salonie w najwyższym miejscu wysokość 4m, przygotowane miejsce na kominek, jest wolny szyb. Wszystkie pokoje niezależne i ustawne, na podłodze panele, ściany gładzone i malowane. Wiele okien (wertykalne i połaciowe) zapewnia doskonałe doświetlenie o każdej porze dnia i roku. Duża kuchnia z jadalnią, z oknem i wygodnymi, nowoczesnymi meblami na wymiar, kompletnie wyposażona w sprzęt agd - lodówka, płyta indukcyjna, piekarnik, wyciąg kominowy, zlew, zmywarka 60', na ścianie bardzo efektowny tynk strukturalny, na podłodze gres. Można z kuchni utworzyć oddzielne pomieszczenie, wystarczy postawić ścinkę gips-karton. W jednej z łazienek wanna i umywalka, ogromne lustro, w drugiej duża kabina prysznicowa i umywalka, pod blatem pralka, w obu grzejniki drabinkowe i szafki. Oprócz gresu zastosowano tu na ścianach tynk strukturalny. WC jest oddzielne, z umywalką. Zostają komfortowe, pojemne szafy w zabudowie. Wygodny i ekonomiczny układ oświetlenia - wiele punktów świetlnych tworzących niezależne strefy, co pozwala uzyskać niezwykły klimat. Niski czynsz - tylko 180zł plus FR na poziomie 2zł/m2. Miejsca postojowe bezpośrednio przed budynkiem. Mieszkanie powstało w 2009 roku w wyniku adaptacji poddasza przedwojennej kamienicy, następnie w 2012r. przeszło remont polegający głównie na zaaranżowaniu i wykończeniu od nowa kuchni i łazienek. Wszystkie instalacje sprawne, bardzo dobra izolacja od strony dachu, indywidualne liczniki wody, własne ogrzewanie gazowe, instalacja trzeciej fazy. W sąsiedztwie na strychu pomieszczenie gospodarcze do dyspozycji. Sprawna wspólnota mieszkaniowa - klatka schodowa po kapitalnym remoncie, za kilka miesięcy odnowiona zostanie elewacja, w wyniku czego piękne, dobrze zachowane ornamenty na froncie kamienicy odzyskają dawny urok. Jest monitoring: kamery przed budynkiem, w prześwicie bramowym x2 i w klatce schodowej. W cenie mieszkania pozostają stałe zabudowy i sprzęt agd. Bardzo korzystna lokalizacja nieruchomości - spokojna ulica, ale już za rogiem tętniąca życiem ul. Krzywoustego i Plac Kościuszki, z drugiej strony Brama Portowa - ważne węzły komunikacji miejskiej, centrum handlowe Kupiec z kinem, puby, pizzerie, banki, przychodnie, apteki itd., sklepy dyskontowe z każdej strony, Społem czynny niemal całą dobę. W promieniu 500m znajdują się 3 place zabaw, boisko Orlik, park, do CH Kaskada 7 minut pieszo. Do obiektów ZUT przy al. Piastów i Wydziału Prawa 3 minuty. Wyjątkowa propozycja dla nowoczesnej rodziny, która doceni klasę architektury z przełomu XIX i XX wieku. Wydanie w kwietniu 2016r. Polecam i zapraszam. Opis i cena powyższej oferty nie jest ofertą w rozumieniu Kodeksu Cywilnego i ma jedynie charakter informacyjny, Arka nie ponosi odpowiedzialności za jej kompletność i zgodność ze stanem faktycznym. Oferta wysłana z programu dla biur nieruchomości - asariWEB Kontakt Alicja Dąbkowska Telefon :",rynek: wtórny rodzaj zabudowy: kamienica materiał budynku: cegła ogrzewanie: gazowe rok budowy: 2009 stan wykończenia: do zamieszkania czynsz: 180 zł forma własności: pełna własność media telewizja kablowa internet,4.0,"Mieszkanie na sprzedaż , Szczecin , Centrum - Zobacz na mapie",97.26,374,4.0,http://otodom.pl/oferta/wyjatkowe-komfortowe-97m2-w-centrum-balkon-ID2L2x3.html
4844,6bfe7d4433875406aa6ef569a4fbb8b3ceb30fac,253c6e77b6b11e1a3e06b6eede2878676c9abf47,default,"Opis Lokalizacja: Szczecin Dąbie okolice ul. Szybowcowej. Lokal znajduje się w budynku z 2009 roku, na zamkniętym osiedlu. Cicha okolica, miejsca parkingowe, place zabaw, szkoła, dyskonty, przychodnia itp. Miejsce w drugiej linii zabudowy. Kameralnie, spokojnie, bezpiecznie. Mieszkanie: Mieszkanie wykończone ze szczególną starannością. Dwa przestronne pokoje, kuchnia otwarta na salon, garderoba, przedpokój, łazienka z wc. Z dużego pokoju wyjście na balkon. Na podłodze dobrej jakości panele oraz terakota. W przedpokoju szafa typu komandor. Kuchnia w zabudowie ze sprzętem agd. Przemyślanie dobrana kolorystyka i dobrej jakości materiały sprawiają, że całość robi bardzo dobre wrażenie. Koszty: Czynsz administracyjny: 230,00zł Stała miesięczna opłata za ogrzewanie 93,00zł Cena: 299 000,00zł Piękne mieszkanie w dobrym miejscu... czego chcieć więcej:)... Zapraszam na prezentację. Gwarant Nieruchomości ul. Chodkiewicza 1 70-344 Szczecin ( pokaż numer ) Powyższe informacje zostały sporzadzone na podstawie oświadczen i nie stanowia oferty w rozumieniu przepisów prawa. Oferta wysłana z programu dla biur nieruchomości - asariWEB Kontakt Adam Hoffmann Telefon :",rynek: wtórny rodzaj zabudowy: blok materiał budynku: cegła ogrzewanie: gazowe rok budowy: 2009 stan wykończenia: do zamieszkania czynsz: 230 zł forma własności: pełna własność media telewizja kablowa internet,1.0,"Mieszkanie na sprzedaż , Szczecin , Dąbie , Szybowcowa - Zobacz na mapie",58.0,299,3.0,http://otodom.pl/oferta/szczecin-dabie-2-pokoje-58m-299tys-ID2J37Y.html
2488,39fc7edcbcbb4d548a7fcb9dbc2b80dbc4521066,253c6e77b6b11e1a3e06b6eede2878676c9abf47,default,"Opis Bardzo ładna, przestronna adaptacja poddasza wykończona z dbałością o każdy szczegół w samym centrum miasta. Lokal o powierzchni całkowitej 120 m2, w którego skład wchodzą duży salon ( 40 m2), otwarta kuchnia na salon w gustownej zabudowie. Łazienka z wanną oraz w.c w glazurze i terakocie, 3 pokoje ( 20,13,12 m2) z jednego pokoju wyjście do salonu. Mieszkanie 5 lat temu przeszło gruntowny remont zostały wymienione wszystkie instalacje elektryczne oraz wodno- kanalizacyjne. Ściany gładzone i malowane, na podłogach położona jest deska oraz terakota. Okna nowego typu PCV, dżwi w mieszkaniu drewniane, wejściowe antywłamaniowe. Ogrzewanie i ciepła woda z pieca gazowego dwu-obiegowego. Opłaty miesięczne około 200 zł. Polecam ze względu na świetną lokalizację. Zapraszam na prezentację. Oferta wysłana z programu dla biur nieruchomości - asariWEB Kontakt Dorota Żabczyńska Telefon :",rynek: wtórny rodzaj zabudowy: kamienica materiał budynku: cegła okna: plastikowe ogrzewanie: gazowe rok budowy: 1905 stan wykończenia: do zamieszkania czynsz: 200 zł forma własności: pełna własność media telewizja kablowa internet,4.0,"Mieszkanie na sprzedaż , Szczecin , Centrum , Piastów - Zobacz na mapie",120.0,299,4.0,http://otodom.pl/oferta/centrum-4-pokoje-po-remoncie-120-m2-299-tys-ID2Sjrj.html
3821,a629ead37dd0247ccc7d39405e6e09670194c2e0,253c6e77b6b11e1a3e06b6eede2878676c9abf47,default,"Opis Osiedle Pionierów - proponujemy do sprzedaży w standardzie developerskim mieszkanie 2 pokojowe, zlokalizowane w nowoczesnym apartamentowcu. Mieszkanie o powierzchni 60,79m2 na IV piętrze z tarasem o powierzchni 36,05m2. W skład mieszkania wchodzi; salon 21,42m2, pokój 8,26m2, łazienka 3,98m2, garderoba 2,85m2, kuchnia 15,37m2, korytarz 8,91m2. Dodatkowo istnieje możliwość zakupu miejsca postojowego pod budynkiem za 25tyś/zł lub miejsca postojowego z komórką za 33tyś/zł / ceny brutto /. Osiedle z dużą ilością zieleni oraz dobrze skomunikowane z pozostałą częścią miasta. KUPUJĄCY NIE PŁACI 2% PODATKU PCC. Zapraszamy na prezentację. STANDARD DEVELOPERSKI; • Ściany wygładzone, pomalowane na kolor biały - przygotowane do ostatecznego malowania, wyposażone w osprzęt elektryczny francuskiej firmy LEGRAND lub równoważne. Podłogi – wylewka betonowa. • Nowoczesne, cichobieżne, dostępne z poziomu garażu, windy firmy KONE. • Drewniane, trzyszybowe okna i drzwi balkonowe firmy PARTNER. • Multimedialną instalację światłowodową dostępną w każdym pokoju dostarcza firma ESPOL. Technologia FTTH (Fiber To The Home). Przepustowości, jakie mogą być świadczone, to najwyższe w tej chwili w Szczecinie – 150 Mb/s -pobieranie, 20 Mb/s - wysyłanie. • Balkony wyłożone płytkami gresowymi - model Arkesia firmy PARADYŻ. • Rolety zewnętrzne w mieszkaniach kondygnacji parterowej. • Drzwi wejściowe antywłamaniowe. • Domofon cyfrowy wykonany ze stali nierdzewnej. • Grzejniki panelowe. • Parapety zewnętrzne. • Parapety wewnętrzne (płyta postformingowa). • Tarasy ogrodowe w mieszkaniach na parterze z wyłożoną warstwą ziemi oraz posianą trawą. • Ciepło do mieszkań dostarczy Szczecińska Energetyka Cieplna - taryfa A.2. • Brak gazu, prąd oraz siła do podłączenia kuchenki elektrycznej lub indukcyjnej od firmy ENEA S.A. • Korytarze - indywidualnie zaprojektowane oświetlenie. • Klatki schodowe - wykładane płytkami gresowymi - model Arkesia firmy PARADYŻ. • Wygodne miejsca postojowe z komórkami lokatorskimi w garażu podziemnym pod budynkiem. • Miejsca postojowe naziemne przy budynku z blokadą i kluczykiem, przeznaczone do wyłącznego użytku. • Osiedle ogrodzone, z bramą wjazdową otwieraną pilotem. • Osiedle chronione • Kompleks trzech boisk sportowych wybudowanych przez inwestora i przekazanych miastu, z osobnym wejściem z terenu osiedla. • Plac zabaw dla dzieci. • Liczna zieleń - 40% powierzchni osiedla Zobacz podobne oferty na Zobacz jak możesz sprzedać swoją nieruchomość Oferta wysłana z programu dla biur nieruchomości - asariWEB Kontakt Jacek Raszkowski Telefon :","rynek: pierwotny rodzaj zabudowy: apartamentowiec materiał budynku: cegła okna: plastikowe ogrzewanie: miejskie rok budowy: 2013 stan wykończenia: do wykończenia czynsz: 200,60 zł forma własności: pełna własność",4.0,"Mieszkanie na sprzedaż , Szczecin , Nowe Miasto , gen. Józefa Sowińskiego - Zobacz na mapie",60.79,383,2.0,http://otodom.pl/oferta/mieszkanie-60-79-m-szczecin-ID2OYAd.html
6508,df1b3f9d2d7007a07722e5b8079bff1f008a61b0,253c6e77b6b11e1a3e06b6eede2878676c9abf47,default,"Opis Mieszkanie 2-poziomowe w standardzie developerskim z tarasem ,4-pokojowe o pow.całkowitej 81,11 m2 w budynku 4-rodzinnym.Do mieszania przynależą 2 miejsce parkingowe. Inwestycja realizowana w formie zamkniętego osiedla ( 2 budynki )w cichej ,spokojnej okolicy.Okna PCV. Teren ogrodzony. Możliwość wykończenia pod klucz.Na terenie plac zabaw dla dzieci.Wewnętrzny dziedziniec z zielenią.Okolice :przedszkole, szkoła, sklepy, gabinety lekarskie.Szybki dojazd do Centrum Szczecina. POLECAM!!!! Kontakt Patrycja Basiejko Telefon :",,1.0,"Mieszkanie na sprzedaż , Szczecin , Warszewo - Zobacz na mapie",81.11,360,4.0,http://otodom.pl/oferta/mieszkanie-81-11-m-szczecin-ID2dMI5.html
461,0bad27b9dffda1acd8fb2a6b7a3afa48eaee8424,253c6e77b6b11e1a3e06b6eede2878676c9abf47,default,"Opis Mieszkanie w nowoczesnym budynku czterorodzinnym na granicy Osowa i Warszewa przy ul. Miodowej. ""Osówka"" to kameralne osiedle domków wolnostojących. W odległości zaledwie 100 metrów - Puszcza Wkrzańska. Tylko 400 metrów - Szczecińska Gubałówka. Mieszkanie w standardzie deweloperskim, na parterze, o pow. użytkowej 77 m2 . Ogródek o pow. 351 m2. Dwa miejsca parkingowe w cenie mieszkania . Okna 3-szybowe. Na powierzchnię mieszkania składają się: duży salon, 2 sypialnie, łazienka, kuchnia, pomieszczenie gospodarcze oraz hol. Z salonu i jednej z sypialni bezpośrednie wyjście na 11-metrowy taras oraz przydomowy ogródek . Niewątpliwym atutem jest położenie osiedla na wysokości przekraczającej 110 m n.p.m., co nadaje temu terenowi cechy klimatu górskiego. Dojazd do centrum miasta zajmuje nie więcej niż 15 minut. Kontakt VASTBOUW POLSKA Telefon :",,,"Mieszkanie na sprzedaż , Szczecin , Warszewo - Zobacz na mapie",77.0,425,3.0,http://otodom.pl/oferta/nowe-77-m2-2-m-postojowe-w-cenie-351-m2-dzialki-ID2WS9x.html
1441,3139099d688887677295f4fb5a1602d1f220c357,253c6e77b6b11e1a3e06b6eede2878676c9abf47,default,"Opis Bardzo ładne trzypokojowe mieszkanie. w niskiej zabudowie. Pokoje rozkładowe, ładnie zaaranżowane. Na podłogach lite drewno sosnowe. Łazienka z wanną i umywalką, WC osobno.Glazura i terakota. Mieszkanie posiada piękny duży taras ( 8m ). Kuchnia w zabudowie widna . Do zamieszkania od zaraz. Obok sklepy , szkoła, przedszkole,autobusy komunikacji miejskiej. Do Centrum Miasta 10 min. Zapraszamy na prezentacje. Informacje zawarte w ofercie sporządzone zostały na podstawie oświadczeń i nie są ofertą w rozumieniu przepisów prawa. Mają one charakter jedynie informacyjny. Zalecamy ich osobistą weryfikację. Kontakt ""FENIX"" Nieruchomości Telefon :",rynek: wtórny rodzaj zabudowy: blok materiał budynku: cegła okna: plastikowe ogrzewanie: miejskie rok budowy: 1990,2.0,"Mieszkanie na sprzedaż , Szczecin , Bezrzecze - Zobacz na mapie",61.0,280,3.0,http://otodom.pl/oferta/godne-uwagi-ID2QjNh.html
3391,85bef14e935e80311f2f32c9bd3610edd4fb2be7,253c6e77b6b11e1a3e06b6eede2878676c9abf47,default,"Opis Marzy Ci się apartament w pobliżu parku, a jednocześnie w Centrum miasta? Ta oferta jest dla Ciebie. Mieszkanie trzypokojowe 72,07m2 (powierzchnia całkowita 82m2), które składa się z: pokoju dziennego z aneksem kuchennym (wyprowadzone wszystkie przyłącza wodno-kanalizacyjne), dwóch sypialni, dużego korytarza, łazienki oraz garderoby. W przedpokoju dodatkowo miejsce na szafę typu Komandor. Z części dziennej wyjście na dwa duże tarasy (powierzchnie: 39,77 m2 oraz 23,48 m2) z których możemy podziwiać przepiękną panoramę Szczecina. Na całej powierzchni mieszkania podłączenia do ogrzewania podłogowego, powieszone są również grzejniki ścienne. Poprowadzone wszystkie instalacje internetowe oraz telewizyjne. Okna PCV, ogrzewanie i ciepła woda z sieci miejskiej. W cenie miejsce parkingowe w garażu podziemnym na poziomie -1 o powierzchni ok.28m2 (miejsce znajduje się na przeciwko wjazdu, więc istnieje możliwość bardzo swobodnego parkowania). W pobliżu sklepy, przystanki komunikacji miejskiej, uczelnie wyższe, Park Kasprowicza. Idealne miejsce dla osób ceniących komfort i wygodę. Zapraszamy na prezentację. W celu umówienia spotkania proszę o wcześniejszy kontakt telefoniczny. Małgorzata Uleryk Tel. ( pokaż numer ) e-mail: Zapraszamy do naszej placówki w Szczecinie przy ul. Staromłyńska 19, Z chęcią pomożemy Ci w uzyskaniu kredytu na zakup tej nieruchomości. Odwiedź naszą stronę: Kontakt Małgorzata Uleryk Telefon :",rynek: wtórny rodzaj zabudowy: apartamentowiec materiał budynku: cegła ogrzewanie: miejskie rok budowy: 2014 stan wykończenia: do wykończenia forma własności: pełna własność media telewizja kablowa internet,5.0,"Mieszkanie na sprzedaż , Szczecin , Pogodno - Zobacz na mapie",72.07,399,3.0,http://otodom.pl/oferta/mieszkanie-72-07-m-szczecin-ID2zu8y.html
7281,6030b7808485f6c6fb1f785007e601a01baaec89,253c6e77b6b11e1a3e06b6eede2878676c9abf47,default,"Opis Przestronne 2 - poziomowe mieszkanie położone na 4 piętrze niskiego bloku na os. Bukowe. Mieszkanie o powierzchni całkowitej 136m2 (użytkowa 106m2) składa się z 4 pokoi, kuchni, jadalni, łazienki, wc oraz holu. Pierwszy poziom o powierzchni 56m2 składa się z obszernego salonu (23m2) z wyjściem na balkon, kuchni ze spiżarnią, jadalni oraz wc (istnieje możliwość zamontowania kabiny prysznicowej). W salonie na podłodze parkiet jesionowy, ściany gładkie i malowane. Kuchnia, jadalnia oraz przedpokój w terakocie. W kuchni pozostają meble w zabudowie wraz ze sprzętem AGD. Na drugi poziom (80m2 po podłodze) prowadzą kręte metalowe schody z drewnianymi stopniami. Drugi poziom składa się z małego holu, 2 przestronnych pokoi z nieuciążliwymi skosami, gabinetu oraz łazienki z wanną. Wszystkie pokoje w wykładzinie, ściany gładzone i malowane. Łazienka w glazurze i terakocie. Okna drewniane, lukarny PCV. Ogrzewanie i CW z sieci miejskiej, czynsz do spółdzielni wraz z FR i zaliczkami na ogrzewanie i wodę wynosi 870zł. W pobliżu przystanek autobusowy, liczne sklepy, place zabaw. Zapraszam na prezentację! więcej zdjęć do oferty znajduje się na naszej stronie numer oferty 272359 Świat Nieruchomości Szczecin - mieszkania, domy i działki. Licencjonowane Biuro Nieruchomości. Gwarantujemy Bezpieczny Zakup. Oferta wysłana z programu dla biur nieruchomości - asariWEB Kontakt Świat Nieruchomości Telefon :",,4.0,"Mieszkanie na sprzedaż , Szczecin , Bukowe - Zobacz na mapie",136.0,399,4.0,http://otodom.pl/oferta/mieszkanie-136-m-szczecin-ID1HAlR.html
3126,f8bb2153e9aeeb2c8d551ec0dd87eede022bea94,253c6e77b6b11e1a3e06b6eede2878676c9abf47,default,"Opis Piękny, nowoczesny apartament, na dwunastym piętrze z widokiem na panoramę miasta. Lokalizacje w Centrum Miasta, w bezpośredniej bliskości Parku Żeromskiego, pl. Roosevelta i pl. Rodła. Powierzchnia 133m2. Przestronny salon z aneksem kuchennym, o powierzchni około 50mkw. Cztery sypialnie, na podłodze panele, duże okna z żaluzjami. W pokoju, i w holu szafy w zabudowie, w modnym stylu i kolorze. Apartament budowany na luksusowym poziomie wykończenia, z dbałością o szczegóły. Nowoczesne, wielopunktowe oświetlenie. Klimatyzacja pozwalająca utrzymać stałą temperaturę, przez cały rok. Obecnie jest to jedyny sposób ogrzewania lokalu. Alternatywnie rozprowadzone jest ogrzewanie tradycyjne, ale przy klimatyzacji nie było potrzeby używania, nawet w czasie zimy. Czynsz do spółdzielni 600zł. razem z ciepłą wodą i funduszem remontowym. Dwie łazienki z WC, w glazurze i terakocie, bardzo gustownie wykończone, z materiałów najwyższej jakości. Lokal jest bardzo przestronny, co podkreśla jeszcze wysokość pomieszczeń wynosząca ok.2,8m. Do mieszkania przynależy piwnica i duży, ok. 50mkw, taras. Budynek czysty i zadbany, wyposażony w domofon i dwie windy. W pobliżu centra handlowe, szkoły, przedszkola, przychodnia, przystanki komunikacji miejskiej. Kilka minut spacerem do Wałów Chrobrego. Mieszkanie w idealnym stanie, nie wymaga wkładu finansowego. Apartament dla najbardziej wymagających Klientów. Jedyna taka oferta na rynku, doskonała dla osób szukających komfortowego apartamentu w wyśmienitej lokalizacji. Polecam ze względu na lokalizację, standard wykończenia, rozkład pomieszczeń. Zapraszamy! Sprawdź naszą pełną ofertę na stronie E L I T E . N I E R U C H O M O S C I . P L gdzie znajdziecie Państwo ponad 20.000 aktualnych ofert nieruchomości ! Każdy zainteresowany zakupem nieruchomości z naszej bazy ofert ma gwarantowaną obsługę w zakresie uzyskania kredytu (bez prowizji od kupującego i dodatkowych kosztów związanych z załatwieniem kredytu). Współpracując z największym brokerem kredytowym na rynku polskim możemy sprawdzić dla Państwa zdolność kredytową w ponad 20 bankach. O szczegóły proszę pytać agenta odpowiedzialnego za to ogłoszenie. *****KUPUJEMY MIESZKANIA Z OBCIĄŻENIAMI I DŁUGAMI ZA GOTÓWKĘ***** ZADZWOŃ ( pokaż numer ) Powyższe ogłoszenie ma wyłącznie charakter informacyjny. Nie stanowi ono oferty w myśl art. 66 i n. ustawy z dnia 23.04.1964r. Kodeks cywilny (Dz.U. 1964r. Nr 16, poz. 93, ze zm.). Oferta wysłana z programu dla biur nieruchomości - asariWEB Kontakt Eliasz Goździk Telefon :",,10.0,"Mieszkanie na sprzedaż , Szczecin , Centrum - Zobacz na mapie",133.0,630,5.0,http://otodom.pl/oferta/apartament-centrum-szczecina-bajkowa-panorama-ID2R1YZ.html
6633,2011bdc7666ccb869e4cd98c5aa2993385888611,253c6e77b6b11e1a3e06b6eede2878676c9abf47,default,"Opis Rewelacyjna oferta jako inwestycja pod wynajem. Pierwotne mieszkanie przerobione na 4 niezależne kawalerki po ok.20m2 każda z własną łazienką i aneksem kuchennym. Udział w strychu i piwnicy. Położone przy Wałach Chrobrego z super widokiem na Odrę, cicha, malownicza okolica. Mieszkanie odświeżone. Ogrzewanie miejskie. Czynsz administracyjny ok. 480zł / zawiera zaliczkę na ogrzewanie, f. remontowy, śmieci/ . Zapraszamy do prezentacji tych 4 kawalerek w jednym, naprawdę warto!. Zdjęcia przedstawiają mieszkanie przed zmianą funkcjonalności. Polecamy. * Oferta Agencji POSESJA Nieruchomości. Przygotowujemy aktualne oferty wg wytycznych klienta! Napisz jakiej nieruchomości szukasz, a wyselekcjonujemy z ogromnej bazy / 20.000 ofert / tylko te właściwe lub szukaj na www.posesja.eu. Ponadto zapewniamy natychmiastową informację o każdej nowej ofercie! Pomożemy nieodpłatnie uzyskać kredyt bankowy / oferta 20 banków /. 23-letnie doświadczenie połączone z nowoczesną obsługą gwarancją naszej skuteczności. Zapraszamy do Agencji Posesja: al. Papieża Jana Pawła II 18 Szczecin tel. ( pokaż numer ) ; Oferta wysłana z programu dla biur nieruchomości - asariWEB Kontakt SŁAWOMIR DROZDOWSKI licencja nr 62 Telefon :",rynek: wtórny rodzaj zabudowy: kamienica materiał budynku: cegła ogrzewanie: miejskie rok budowy: 1950 stan wykończenia: do zamieszkania czynsz: 480 zł,,"Mieszkanie na sprzedaż , Szczecin , Centrum , Jana z Kolna - Zobacz na mapie",69.0,350,4.0,http://otodom.pl/oferta/mieszkanie-69-m-szczecin-ID29ue9.html
