,_cached_page_id,_template,_type,description,details,floor,location,pow,price,rooms,url
3974,5ed10d20ca51f1d95ec1bd6dc3ffe9e2e9956d69,253c6e77b6b11e1a3e06b6eede2878676c9abf47,default,"Opis Osiedle Pionierów - proponujemy do sprzedaży w standardzie developerskim mieszkanie II poziomowe, zlokalizowane w nowoczesnym apartamentowcu. Mieszkanie o powierzchni 41,92m2 na III piętrze z balkonem o powierzchni 2,60m2. W skład mieszkania wchodzi; salon 23,07m2, kuchnia 10,20m2, łazienka 4,23m2, korytarz 2,00m2, garderoba 2,33m2 i na II poziomie poddasze użytkowe 16,23m2. Dodatkowo istnieje możliwość zakupu miejsca postojowego pod budynkiem za 25tyś/zł lub miejsca postojowego z komórką za 33tyś/zł / ceny brutto /. Osiedle z dużą ilością zieleni oraz dobrze skomunikowane z pozostałą częścią miasta. KUPUJĄCY NIE PŁACI 2% PODATKU PCC. Zapraszamy na prezentację. STANDARD DEVELOPERSKI; • Ściany wygładzone, pomalowane na kolor biały - przygotowane do ostatecznego malowania, wyposażone w osprzęt elektryczny francuskiej firmy LEGRAND lub równoważne. Podłogi – wylewka betonowa. • Nowoczesne, cichobieżne, dostępne z poziomu garażu, windy firmy KONE. • Drewniane, trzyszybowe okna i drzwi balkonowe firmy PARTNER. • Multimedialną instalację światłowodową dostępną w każdym pokoju dostarcza firma ESPOL. Technologia FTTH (Fiber To The Home). Przepustowości, jakie mogą być świadczone, to najwyższe w tej chwili w Szczecinie – 150 Mb/s -pobieranie, 20 Mb/s - wysyłanie. • Balkony wyłożone płytkami gresowymi - model Arkesia firmy PARADYŻ. • Rolety zewnętrzne w mieszkaniach kondygnacji parterowej. • Drzwi wejściowe antywłamaniowe. • Domofon cyfrowy wykonany ze stali nierdzewnej. • Grzejniki panelowe. • Parapety zewnętrzne. • Parapety wewnętrzne (płyta postformingowa). • Tarasy ogrodowe w mieszkaniach na parterze z wyłożoną warstwą ziemi oraz posianą trawą. • Ciepło do mieszkań dostarczy Szczecińska Energetyka Cieplna - taryfa A.2. • Brak gazu, prąd oraz siła do podłączenia kuchenki elektrycznej lub indukcyjnej od firmy ENEA S.A. • Korytarze - indywidualnie zaprojektowane oświetlenie. • Klatki schodowe - wykładane płytkami gresowymi - model Arkesia firmy PARADYŻ. • Wygodne miejsca postojowe z komórkami lokatorskimi w garażu podziemnym pod budynkiem. • Miejsca postojowe naziemne przy budynku z blokadą i kluczykiem, przeznaczone do wyłącznego użytku. • Osiedle ogrodzone, z bramą wjazdową otwieraną pilotem. • Osiedle chronione • Kompleks trzech boisk sportowych wybudowanych przez inwestora i przekazanych miastu, z osobnym wejściem z terenu osiedla. • Plac zabaw dla dzieci. • Liczna zieleń - 40% powierzchni osiedla Zobacz podobne oferty na Zobacz jak możesz sprzedać swoją nieruchomość Oferta wysłana z programu dla biur nieruchomości - asariWEB Kontakt Jacek Raszkowski Telefon :","rynek: pierwotny rodzaj zabudowy: apartamentowiec materiał budynku: cegła okna: plastikowe ogrzewanie: miejskie rok budowy: 2013 stan wykończenia: do wykończenia czynsz: 138,30 zł forma własności: pełna własność",3.0,"Mieszkanie na sprzedaż , Szczecin , Nowe Miasto , gen. Józefa Sowińskiego - Zobacz na mapie",41.92,281,1.0,http://otodom.pl/oferta/mieszkanie-41-92-m-szczecin-ID2OlTH.html
873,dc5b8ec3f5897b8a0fb1f398f2e48b79f4e61582,253c6e77b6b11e1a3e06b6eede2878676c9abf47,default,"Opis Gumieńce, niepowtarzalne 3 pokojowe mieszkanie na Osiedlu Reda. W skład mieszkania wchodzą 3 rozkładowe pokoje 30, 12, 8 m2, łazienka i przedpokój. Największy pokój stanowi połączenie salonu z kuchnią i jadalnią. Istnieje możliwość jego przerobienia na oddzielny pokój i kuchnię. Przestronny korytarz zabudowany szafą typu Komandor. Łazienka z wanną, płytki i terakota. Pozostała część mieszkania pokryta panelami podłogowymi. Do lokalu przynależy piwnica 3 m2. Budynek położony jest w spokojnej części Gumieniec, oddalony od głównej ulicy, a w niedalekiej odległości znajduje się Wydział Ekonomiczny Uniwersytetu Szczecińskiego. Mieszkanie bardzo jasne i słoneczne, zaprojektowane z dbałością o szczegóły.Budynek kilka lat temu przeszedł gruntowny remont, został ocieplony. W mieszkaniu pozostaje zabudowa kuchenna i szafa na korytarzu. Gorąco polecam i zapraszam na prezentacje. Zobacz podobne oferty na Zobacz jak możesz sprzedać swoją nieruchomość Oferta wysłana z programu dla biur nieruchomości - asariWEB Kontakt Jacek Raszkowski Telefon :",rynek: wtórny rodzaj zabudowy: blok materiał budynku: wielka płyta okna: plastikowe ogrzewanie: miejskie rok budowy: 1980 stan wykończenia: do zamieszkania czynsz: 700 zł forma własności: spółdzielcze wł. z KW,,"Mieszkanie na sprzedaż , Szczecin , Gumieńce , Bronowicka - Zobacz na mapie",61.16,245,3.0,http://otodom.pl/oferta/mieszkanie-61-16-m-szczecin-ID2WAJh.html
2590,158171ac30bb579cc1818c02d8f6b0bc2cfc3060,253c6e77b6b11e1a3e06b6eede2878676c9abf47,default,"Opis Szczecin , Słoneczne , Turkusowa, 2 pokoje , Sprzedaż , 265 000 PLN. WGN Nieruchomości, Al. Bohaterów Warszawy 40, Galeria Nowy Turzyn, 1 piętro. KUPUJĄCY NIE PŁACI PROWIZJI, POŚREDNIK WYNAGRADZANY JEST PRZEZ SPRZEDAJĄCEGO. WYŁĄCZNOŚĆ. TYLKO U NAS. CENA DO NEGOCJACJI. Na sprzedaż doinwestowane , słoneczne mieszkanie 2- pokojowe z osobną kuchnią i balkonem o powierzchni 52.52 m2 na czwartym piętrze niskiego bloku na Os. Słonecznym. Idealna oferta dla każdego kto ceni sobie spokój. Mieszkanie rozkładowe, składa się z salonu z wyjściem na balkon , sypialni z dużą szafą w zabudowie , kuchni z nowoczesną zabudową i sprzętami AGD , osobnym WC , łazienką w nowoczesnej terakocie i glazurze z wanną , oraz z przedpokoju z dodatkowym pomieszczeniem zagospodarowanym na garderobę. WIĘCEJ SZCZEGÓŁÓW NA TEMAT OFERTY POD NUMEREM TELEFONU ( pokaż numer ) Nieruchomość usytuowana w spokojnej okolicy, otoczeniu zadbanej zabudowy oraz terenów zielonych. Dzięki swojej lokalizacji blisko licznych sklepów, marketów, punktów usługowo-handlowych, przystanków komunikacji miejskiej oraz placówek edukacyjnych nieruchomość odpowiednia dla każdego klienta. NAJWAŻNIEJSZE INFORMACJE Własność z KW Czynsz: ok. 550 zł Opłaty w czynszu: zaliczka na wodę ciepłą , zaliczka na ogrzewanie , śmieci, eksploatacja , gaz Opłaty wg liczników: prąd Woda ciepła: miejska Ogrzewanie: miejskie Dostępne media: prąd, woda, kanalizacja, internet, telefon, TV kablowa STAN TECHNICZNY Mieszkanie wymaga kosmetycznego odświeżenia , a stan techniczny oceniany jako bardzo dobry Wymienione instalacje wymienione w 2012 roku Podgrzewana podłoga w łazience. W cenie pozostaje: Całe umeblowanie widoczne na zdjęciach z wyjątkiem lodówki, pralki oraz sprzętu RTV. Okna: nowe PCV Balkon: tak Widna kuchnia: tak Piwnica: tak Układ mieszkania: rozkładowe, brak pokoi przechodnich BUDYNEK Miłe, spokojne sąsiedztwo Stan techniczny budynku oceniany jako dobry OTOCZENIE Natężenie hałasu: cisza W otoczeniu zadbana zabudowa Okolica bezpieczna, spokojne sąsiedztwo, tereny zielone Miejsca parkingowe: odpowiednia ilość przy budynku Bardzo blisko komunikacji miejskiej ( szybki tramwaj) Polecam i zapraszam na prezentację. W razie wszelkich pytań (nieruchomość, kredyt na zakup) proszę o kontakt telefoniczny lub mailowy. Rudnicka Karolina ( pokaż numer ) WGN Szczecin Al. Bohaterów Warszawy 40, Galeria Nowy Turzyn, 1 piętro. Każdy zainteresowany zakupem nieruchomości za pośrednictwem Naszego biura ma gwarantowaną obsługę w zakresie uzyskania kredytu (bez prowizji od kupującego i dodatkowych kosztów związanych z załatwieniem kredytu). Dzięki współpracy z ok. 20 Bankami, pomagamy w negocjowaniu jak najniższej raty oraz uzyskaniu optymalnego bankowego kredytu na zakup, budowę lub remont nieruchomości. Kontakt Karolina Rudnicka Telefon :",rynek: wtórny forma własności: pełna własność,4.0,"Mieszkanie na sprzedaż , Szczecin , Słoneczne , Słoneczne - Zobacz na mapie",52.52,265,2.0,http://otodom.pl/oferta/mieszkanie-52-52-m-szczecin-ID2RYNJ.html
4738,ff84712c2e7984c56e8b2f9542c47ec9862809a9,253c6e77b6b11e1a3e06b6eede2878676c9abf47,default,"Opis Przestronne, klimatyczne mieszkanie z dużym balkonem wychodzącym na ogrody domków jednorodzinnych. Trzy lata temu przeprowadzono gruntowny remont w mieszkaniu (odnowione deski poniemieckie, wygładzone i malowane ściany, wyremontowana kuchnia i łazienka). Ogrzewanie gazowe(nowy piec gazowy-na gwarancji). Drzwi antywłamaniowe Gerda. Duże okna p c v (z zamontowanymi roletami wewnętrznymi) wychodzące na trzy strony świata (wsch., zach., pd.) ,dzięki czemu jest jasno i słonecznie. Mieszkanie składa się z 5 rozkładowych pokoi o powierzchni 24,21,21,18 i 9 metrów. Duża kuchnia 13m (z dwiema spiżarkami) w glazurze i terakocie,(zmywarka i kuchenka z piekarnikiem w zabudowie). Łazienka z oknem o pow. 6m i zabudową na wymiar. Niewątpliwym atutem mieszkania jest osłonięty balkon na którym można oglądać zachody słońca. Czynsz ok.350 zł na 3 osoby. Ładna, wyremontowana klatka schodowa, nowy dach. Bardzo dobra lokalizacja, ulica Piotra Skargi, blisko Parku Kasprowicza, 5 min spacerem do pomnika 3 Orłów, Jeziora Rusałka. W pobliżu Urząd Miasta, liczne sklepy, apteki, przedszkola, rynek Manhattan. Ścieżki rowerowe, basen olimpijski. Lokalizacja nieruchomości poza strefą płatnego parkowania, możliwość parkowania przy budynku, na terenie wspólnoty. Polecam wszystkim ceniącym bliskość wygód miejskich a jednocześnie chcącym odpocząć w otoczeniu zieleni. Termin wydania mieszkania do uzgodnienia. Oferta wysłana z programu dla biur nieruchomości - asariWEB Kontakt Monika Schulz Telefon :",rynek: wtórny rodzaj zabudowy: kamienica materiał budynku: cegła ogrzewanie: miejskie rok budowy: 1935 stan wykończenia: do zamieszkania czynsz: 350 zł forma własności: pełna własność,2.0,"Mieszkanie na sprzedaż , Szczecin , JASNE BŁONIA, ks. Piotra Skargi - Zobacz na mapie",132.0,548,5.0,http://otodom.pl/oferta/mieszkanie-132-m-szczecin-ID2JVQ5.html
2961,e2e7fa1bd6d77ec2ba2c00e78ea6635bf1920b87,253c6e77b6b11e1a3e06b6eede2878676c9abf47,default,"Opis Atrakcyjne, dwupoziomowe, przestronne mieszkanie na Gumieńcach. Nowoczesne, w pełni rozkładowe, z balkonem, usytuowane w niskim budynku wielorodzinnym. Mieszkanie ma imponującą powierzchnię użytkową 125,66 m2 (całkowitą ok 150 m2), składa się 4 pokoi, 2 łazienek, kuchni, 2 przedpokoi, 2 garderób i spiżarni. Jest możliwość wyodrębnienia kolejnego, piątego pokoju kosztem dużego salonu. Na pierwszym poziomie znajduje się otwarty salon, przestronny pokój, kuchnia, łazienka z WC oraz przedpokój. W całym mieszkaniu za wyjątkiem kuchni i łazienek na podłogach panele podłogowe wysokiej jakości. W salonie ściany gładkie malowane. Bezpośrednio z salonu wyjście na obszerny balkon z widokiem na ogrodzony plac zabaw. W drugim, dużym pokoju znajduje się mała garderoba, ściany gładkie malowane. Kuchnia z meblami w zabudowie w cenie mieszkania, na podłodze terakota, ściany częściowo wyłożone glazurą. Łazienka wraz z WC w glazurze i terakocie wysokiej klasy, w łazience, wanna, umywalka i bidet. W przedpokoju ściany gładkie malowane z atrakcyjnymi wbudowanymi półkami. Z przedpokoju wejście do drugiej garderoby i spiżarni. Na drugi poziom prowadzą drewniane schody, znajdują się dwa pokoje oraz duża oryginalna łazienka w glazurze i terakocie wysokiej klasy z wanną, umywalką, toaletą i pralką. Oryginalne zabudowy pozwalają na wykorzystanie w pełni powierzchni całkowitej mieszkania. Ogrzewanie i ciepła woda z sieci miejskiej. Polecam i zapraszam na prezentacje Oferta wysłana z programu dla biur nieruchomości - asariWEB Kontakt Paweł Placek Telefon :",rynek: wtórny rodzaj zabudowy: blok materiał budynku: cegła ogrzewanie: miejskie rok budowy: 1990 stan wykończenia: do zamieszkania czynsz: 845 zł forma własności: spółdzielcze własnościowe media telewizja kablowa internet telefon,4.0,"Mieszkanie na sprzedaż , Szczecin , Gumieńce , Hrubieszowska - Zobacz na mapie",125.66,310,4.0,http://otodom.pl/oferta/mieszkanie-125-66-m-szczecin-ID2Rsl7.html
6248,9d5e1f2a940f8ecba367dc448bac7c6eb122af7d,253c6e77b6b11e1a3e06b6eede2878676c9abf47,default,"Opis Na sprzedaż mieszkanie 2 pokojowe usytuowane na 4 piętrze w bloku mieszkalnym cztero-piętrowym. Mieszkanie 2 pokojowe ,pokoje rozkładowe z większego wyjście na balkon z pięknym widokiem na las. Nieruchomość do remontu ..Oferta godna polecenia z uwagi na lokalizacje oraz dobra cenę. Obecnie do końca kwietnia jest wynajmowane. Oferta wysłana z programu dla biur nieruchomości - asariWEB Kontakt Jarosław Dudziński Telefon :",rynek: wtórny rodzaj zabudowy: blok materiał budynku: cegła ogrzewanie: miejskie rok budowy: 1992 stan wykończenia: do zamieszkania czynsz: 500 zł forma własności: spółdzielcze własnościowe media internet telewizja kablowa,4.0,"Mieszkanie na sprzedaż , Szczecin , Kijewo , Świstacza - Zobacz na mapie",50.0,170,2.0,http://otodom.pl/oferta/mieszkanie-50-m-szczecin-ID1HMh3.html
1817,72c2de03dc0f3fd1f924216db79462e65d137fed,253c6e77b6b11e1a3e06b6eede2878676c9abf47,default,"Opis Na sprzedaż mieszkanie zlokalizowane w dzielnicy Płonia, w bloku na 2 piętrze. Na powierzchnię 45,3 m2 wchodzą w skład dwa pokoje , widna kuchnia, łazienka i toaleta. Z jednego pokoju wyjście na balkon. Mieszkanie w dobrym standardzie, na ścianach ładna tapeta, kuchnia wyposażona w meble na wymiar ze sprzętem agd. Do mieszkania przynależy garaż murowany, na zasadzie użytkowania wieczystego. Mieszkanie szczególnie polecane ze względu na standard wykończenia oraz atrakcyjną cenę. Zapraszam na prezentację. Kontakt Marta Guz Telefon :",rynek: wtórny rodzaj zabudowy: blok stan wykończenia: do zamieszkania czynsz: 450 zł,2.0,"Mieszkanie na sprzedaż , Szczecin , Płonia , PRZYSZŁOŚCI - Zobacz na mapie",45.3,170,2.0,http://otodom.pl/oferta/mieszkanie-45-30-m-szczecin-ID2U0Gd.html
6597,49e8e72b721124b6b70f6d383dc062c4a12ac6ad,253c6e77b6b11e1a3e06b6eede2878676c9abf47,default,"Opis Zapytaj o niepublikowane oferty w tej dzielnicy. Gwarancja szybkiej i bezpiecznej sprzedaży. Sprzedam słoneczną kawalerkę w dzielnicy Pomorzany, w bloku z 1980 roku. Mieszkanie zlokalizowane jest na 4 piętrze w niskim 4 piętrowym bloku. Klatka schodowa została odnowiona, budynek jest ocieplony. Na powierzchnię 30,94m2 składa się: pokój (18m2), kuchnia (7m2), łazienka (5m2) oraz przedpokój w zabudowie typu Komandor. Na podłodze parkiet, w kuchni i łazience glazura i terakota. Mieszkanie jest bardzo ciepłe i słoneczne, okolica cicha i spokojna. Czynsz do spółdzielni w granicach 280zł. Do mieszkania przynależy piwnica. Wysyłając zapytanie z tego miejsca proszę powołać się na numer: Nr oferty: MS - 5892 Opiekun oferty: Adriana Ostrowska - Specjalista ds. sprzedaży i wynajmu nieruchomości mieszkalnych Nr licencji pośrednika 5071 Informacje zawarte w ofercie sporządzone zostały na podstawie oświadczeń, więc nie stanowią ""oferty"" w rozumieniu przepisów prawa. Pośrednik odpowiedzialny zawodowo za wykonanie umowy pośrednictwa: Jarosław Mazurek (licencja nr: 5071) Oferta wysłana z systemu Galactica Virgo Kontakt Adriana Ostrowska Telefon :",rynek: wtórny rodzaj zabudowy: blok okna: plastikowe czynsz: 280 zł,4.0,"Mieszkanie na sprzedaż , Szczecin , Pomorzany - Zobacz na mapie",30.94,143,1.0,http://otodom.pl/oferta/mieszkanie-30-94-m-szczecin-ID2acPN.html
784,742da0d82443a253d5a5da046dcdcb88538f4722,253c6e77b6b11e1a3e06b6eede2878676c9abf47,default,"Opis Mieszkanie na 3 piętrze w bloku z 1989 roku. Na powierzchnię 55,5 m2 składają się 3 pokoje - jeden z balkonem, kuchnia, łazienka, osobne Wc, przedpokój. Mieszkanie do odświeżenia, okna PCV, na podłogach panele, kuchnia w zabudowie. Do mieszkania przynależy piwnica o powierzchni 3,80 m2. Czynsz 320 zł, ogrzewanie i ciepła woda z sieci miejskiej. Przy budynku wiele miejsc parkingowych. Dużo terenów zielonych, rekreacyjnych, blisko komunikacja. Okolica cicha, spokojna i zadbana. Gorąco polecam ze względu na świetną lokalizację. Zapraszam na prezentację. Kontakt Katarzyna Rachoń Telefon :",rynek: wtórny rodzaj zabudowy: blok okna: plastikowe ogrzewanie: miejskie rok budowy: 1989 stan wykończenia: do zamieszkania czynsz: 320 zł forma własności: pełna własność media telewizja kablowa internet,3.0,"Mieszkanie na sprzedaż , Szczecin , Pogodno , STEFANA GROTA-ROWECKIEGO - Zobacz na mapie",55.5,275,3.0,http://otodom.pl/oferta/mieszkanie-55-50-m-szczecin-ID2WKfW.html
8309,455f627ef1368463d336ace1cf1f2e6b48fa44fe,253c6e77b6b11e1a3e06b6eede2878676c9abf47,default,"Opis Odbiór budynku w grudniu 2016r. Nowa inwestycja w Śródmieściu - nowoczesne, starannie zaprojektowane osiedle. Ide­alnie położone, świetnie skomunikowane, z dostępem do wszelkich miejskich udogodnień. Mieszkanie 2 pokojowe o pow. 36,35m2 składająca się z salonu z aneksem kuchennym 24,07m2 z wyjściem na balkon typu loggia 2,71m2, sypialni 8,14m2 oraz łazienki z wc 3,84m2. Standard deweloperski. Ogrzewanie miejskie, czynsz ok 5zł/m2. Budynek apartamentowy 5 piętrowy z windą. Możliwość zakupu komórki w cenie 5.000zł oraz garażu w parkingu podziemnym. W bliskiej odległości: przedszkola, szkoły, przychodnie, centra handlowe oraz obiekty kulturalne. Jakość zabudowy harmonizuje z wyjątkowością lokalizacji - najwyższej jakości materiały, energooszczędne i przyjazne. Podziemne parkingi dla mieszkańców, starannie zaplanowana przestrzeń wokół budynków i miejsca do rekreacji dla dzieci. Zaletą mieszkań na najwyższych kondygnacjach są duże tarasy. Polecam i zapraszam do prezentacji! Powyższa propozycja nie jest ofertą handlową w rozumieniu przepisów Kodeksu Cywilnego, a podane w niej informacje są spisane według zapewnień właściciela nieruchomości i zaleca się ich osobiste sprawdzenie. Oferta wysłana z programu dla biur nieruchomości - asariWEB Kontakt Patrycja Grabczak Telefon :",,4.0,"Mieszkanie na sprzedaż , Szczecin , Centrum , Janusza Kusocińskiego - Zobacz na mapie",36.35,194,2.0,http://otodom.pl/oferta/mieszkanie-36-35-m-szczecin-ID2cHyn.html
6863,c3ab4c8dce93f3b2e4e7f876ed919da79c13baaf,253c6e77b6b11e1a3e06b6eede2878676c9abf47,default,"Opis 3 pokojowe mieszkanie o pow. 82m2, położone na parterze w 3 piętrowej kamienicy. W skład mieszkania wchodzą: 3 rozkładowe pokoje, widna kuchnia (8m2), łazienka z WC, przestronny przedpokój, oraz dodatkowe pomieszczenie z którego można urządzić garderobę. Okna w mieszkaniu zostały częściowo wymienione na PCV. Ogrzewanie i cw z piecyka gazowego. Niski czynsz 250 zł. Do mieszkania przynależy duża piwnica. Atrakcyjna lokalizacja w pobliżu przystanki komunikacji miejskiej i sklepy. Polecam i zapraszam na prezentację. Kontakt Sandra ( pokaż numer ) Gwarant Nieruchomości ul. Chodkiewicza 1 70-344 Szczecin ( pokaż numer ) Powyższe informacje zostały sporzadzone na podstawie oświadczen i nie stanowia oferty w rozumieniu przepisów prawa. Oferta wysłana z programu dla biur nieruchomości - asariWEB Kontakt Sandra Dołżańska Telefon :",rynek: wtórny rodzaj zabudowy: kamienica ogrzewanie: gazowe rok budowy: 1938 forma własności: pełna własność,,"Mieszkanie na sprzedaż , Szczecin , Niebuszewo , Juliana Ursyna Niemcewicza - Zobacz na mapie",82.0,250,3.0,http://otodom.pl/oferta/mieszkanie-82-m-szczecin-ID21KeF.html
7151,a813c76297398938dd9c191aaf7d17c274b3fcea,253c6e77b6b11e1a3e06b6eede2878676c9abf47,default,"Opis Mieszkanie na trzecim piętrze budynku położonego w centrum Szczecina w bardzo dobrym punkcie komunikacyjnym. W pobliżu liczne sklepy, poczta, szkoła, itp. Budynek z 1992 r. z cegły w którym mieści się do dyspozycji mieszkańców sauna, sala gimnastyczna, suszarnia i wózkarnia. Trzy rozkładowe pokoje pierwotnie były 4 jest możliwość przywrócenia do stanu pierwotnego. Na podłogach deska barlinecka , ściany gładkie malowane. Balkon o pow. ok. 4m2. Łazienka z wanną, kabiną prysznicową i WC. Dodatkowo osobne WC z umywalką. Mieszkanie bardzo ciepłe. Niskie opłaty za ogrzewanie. Czynsz ok. 470 zł, w tym FR, ryczałt za ogrzewanie, woda, ścieki, sprzątanie posesji. Do mieszkania przynależy piwnica. Wokół budynku ogólnodostępne miejsca postojowe poza strefą płatnego postoju. Idealne dla ludzi ceniących sobie komfort i wygodę. Polecam i zapraszam na prezentację. Cena do negocjacji. Więcej zdjęć do nieruchomości znajduje się na stronie Świat Nieruchomości . Świat Nieruchomości Szczecin - mieszkania, domy i działki. Licencjonowane Biuro Nieruchomości. Gwarantujemy Bezpieczny Zakup. Oferta wysłana z programu dla biur nieruchomości - asariWEB Kontakt Świat Nieruchomości Telefon :",,3.0,"Mieszkanie na sprzedaż , Szczecin , Centrum , Dziecka - Zobacz na mapie",80.81,360,4.0,http://otodom.pl/oferta/mieszkanie-80-81-m-szczecin-ID1SVpL.html
4701,ebea0cf2d216be23a7833e58a4dfcf12f48903a5,253c6e77b6b11e1a3e06b6eede2878676c9abf47,default,"Opis Na sprzedaż 2-pokojowe mieszkanie o pow. 36 mkw. na V piętrze w wieżowcu w centrum miasta przy al. Wojska Polskiego w Szczecinie. Pokoje osobne, kuchnia bez okna, ale jest normalnym zamkniętym pomieszczeniem kuchennym. Mieszkanie w pełni rozkładowe, większy pokój z balkonem, Mieszkanie 3 lata temu przeszło generalny remont. Została w całości wymieniona instalacja elektryczna, piony., nowe drzwi wewnętrzne, zewnętrzne. Ogrzewanie miejskie, ciepła woda również z sieci miejskiej. Na ścianach gładzie, okna pcv.,na podłodze panele. Umeblowanie widoczne na zdjęciach może pozostać. Mieszkanie wolne od zaraz. Cena 165 000 zł. Makler Małgorzata tel. ( pokaż numer ) Zapraszam na prezentację. Kontakt MAŁGORZATA PASZKIEWICZ Telefon :",rynek: wtórny rodzaj zabudowy: blok okna: plastikowe ogrzewanie: miejskie rok budowy: 1980 stan wykończenia: do zamieszkania czynsz: 300 zł forma własności: pełna własność,5.0,"Mieszkanie na sprzedaż , Szczecin , Centrum , AL. WOJSKA POLSKIEGO - Zobacz na mapie",36.0,165,2.0,http://otodom.pl/oferta/mieszkanie-36-m-szczecin-ID2Kdap.html
841,1c804bfd6e49edf1a1affdb6cdb909ac5985ea22,253c6e77b6b11e1a3e06b6eede2878676c9abf47,default,"Opis Polecam mieszkanie dwu pokojowe z ogródkiem położone w Mierzynie.Gmina Dobra. Mieszkanie rozkładowe, bardzo funkcjonalne. Duży przestronny salon otwarty na kuchnie.Z salonu wyjście na taras i do ogródka. Kuchnia w zabudowie meblowej wraz ze sprzętem AGD pozostaje w cenie. W sypialni zabudowana szafa.W pokojach na podłogach panele. Okna PCV,ściany malowane. Łazienka w glazurze i terakocie o jasnych neutralnych kolorach.Kabina prysznicowa z hydromasażem. W przedpokoju duża zabudowana szafa typu komandor.Na podłodze terakota,ściany malowane. Oferta wysłana z programu dla biur nieruchomości - asariWEB Kontakt Teresa Szymańska 694 647 647 Telefon :",rynek: wtórny rodzaj zabudowy: blok materiał budynku: cegła ogrzewanie: gazowe rok budowy: 2000 stan wykończenia: do zamieszkania czynsz: 230 zł forma własności: pełna własność,,"Mieszkanie na sprzedaż , Mierzyn , zachodniopomorskie , Grafitowa - Zobacz na mapie",52.0,239,2.0,http://otodom.pl/oferta/mieszkanie-52-m-mierzyn-ID2W83n.html
4704,dfed8acea40e224649e939028df53cb324cfbd19,253c6e77b6b11e1a3e06b6eede2878676c9abf47,default,"Opis Do sprzedania dwupoziomowe mieszkanie w spokojnej dzielnicy.Słoneczne ,ciepłe i tanie w utrzymaniu prawie 100 m 2..Na parterze otwarta przestrzeń :salon z wyjściem na balkon,piękna zabudowana kuchnia ,połączona z jadalnią ,oraz łazienka z natryskiem i wc.Drugi poziom : 2 sypialnie z połaciowymi oknami, łazienka z wanną z hydromasażem.W mieszkaniu zabudowy typu komandor z lustrami.Całość bardzo gustownie urządzona z możliwością pozostawienia .Bezproblemowy dojazd komunikacją miejską. W pobliżu sklepy ,punkty usługowe. Polecam i zapraszam na prezentację. ::DODATKOWE INFORMACJE Rodzaj budynku: blok Głośność: ciche Widok: na inne budynki Gaz: brak Woda: jest Dojazd: droga asfaltowa Otoczenie: działki zabudowane Ogrzewanie: własne dla budynku Komunikacja publ.: autobus miejski, tramwaj Rozkład: dwustronne rozkładowe Usytuowanie: dwustronne Rodzaj mieszkania: dwupoziomowe Piwnica [m2]: 2,20 Stan lokalu: Do wprowadzenia Okna: nowe PCV Balkon: duży Powierzchnia użytkowa [m2]: 97,84 Ilość pokoi: 3 Ilość sypialni: 2 Podłogi pokoi: deski Ściany pokoi: gładzie gipsowe Typ kuchni: aneks kuchenny - połączony z jadalnią Rodzaj kuchni: z zabudową kuchenną Podłoga kuchni: gres Typ łazienki: razem z wc Ilość łazienek: 2 Glazura łazienki: starszego typu Podłoga łazienki: terakota Wyposażenie łazienki: wanna z hydromasażem, natrysk Ściany łazienki: glazura Ilość przedpokoi: 1 Podłoga przedpokoi: deski Ściany przedpokoi: gładzie gipsowe ::KONTAKT DO AGENTA Bogumiła Ambroziak ( pokaż numer ) ( pokaż numer ) ::DANE BIURA Lex House- Centrala Agencja Obrotu Nieruchomościami Śląska 40 70-432 Szczecin ( pokaż numer ) Pośrednik odpowiedzialny zawodowo za wykonanie umowy pośrednictwa: Bogumiła Ambroziak (licencja nr: 9850) Oferta wysłana z systemu Galactica Virgo Kontakt Bogumiła Ambroziak Telefon :",rynek: wtórny rodzaj zabudowy: blok okna: plastikowe ogrzewanie: inne czynsz: 500 zł forma własności: pełna własność,4.0,"Mieszkanie na sprzedaż , Szczecin , Żelechowa - Zobacz na mapie",97.84,335,3.0,http://otodom.pl/oferta/mieszkanie-97-84-m-szczecin-ID2KdV9.html
